uid,body,title,url,newspaper_uid,host,n_token_title,n_token_body
71658397066adb1b89b348ddaffded41,"Shakira tiene por delante un 2020 muy intenso, en el que destaca el concierto que ofrecer con Jennifer Lpez en la Super Bowl, donde representar a ""los latinos, que pasan por dificultades muy serias dentro y fuera de Estados Unidos, pero que all podrn defender su cultura con la frente en alto"". La cantante colombiana se ha mostrado muy contenta del buen momento por el que pasa la msica latina, ""porque significa que los que controlaban las compuertas y no dejaban pasar a la msica en espaol han perdido la batalla"". ""Cuando yo empec en Colombia ni tan siquiera haba una escena para los artistas locales de msica 'pop' -ha recordado- y en Estados Unidos era difcil entrar porque haba programadores de radio a los que sencillamente no les daba la gana de poner msica en espaol"".",'Perder la voz fue el momento ms negro de mi vida': Shakira,https://www.eltiempo.com//cultura/musica-y-libros/shakira-habla-de-su-documental-el-dorado-430528,eltiempo,www.eltiempo.com,6,62
34665178bf86f28ab64255f71747cb3f,"Es usted del club de los distrados? siente que con el tiempo ha empezado a experimentar undeclive en sus procesos atencionales? o sufre las consecuencias de vivir, estudiar o trabajar con alguien que tiene serios problemas de atencin? S entra en alguno de estos tres grupos, los consejos que la psicloga ngela Caro Delgado, docente del Politcnico Grancolombiano con mster en Neuropsicologa, prepar para #10CosasQue, pueden serletiles en el da a da:",Es usted distrado? Use estas 10 tcnicas y mejore su concentracin,https://www.eltiempo.com//vida/educacion/como-puedo-mejorar-mi-concentracion-tecnicas-faciles-dadas-por-expertos-431082,eltiempo,www.eltiempo.com,6,38
397c2321177ddf9084626e2d92cd8dce,"Este martes, los servicios N07, N11 y N15 del SITP dejaron de circular luego de que se hicieran cambios en el sistema con el propsito de optimizar el servicio. Adicionalmente, se anunci que las rutas N08, N09, N13 y N14 solo operarn en la maana.",Cambios en servicios del SITP dejan inconformes a los usuarios,https://www.eltiempo.com//bogota/cambios-en-servicios-del-sitp-dejan-inconformes-a-los-usuarios-430876,eltiempo,www.eltiempo.com,6,18
7c8a7bcc2c92b7fa969e2f6fed2815ee,"""Me llamo Saturnino Freixa Santcliment. Siempre he pensado que mi nombre me ha pedido una vida extravagante, oxigenada por el dinero y vida de reconocimiento. As se presenta el protagonista y narrador de Una persona perfecta, la nueva novela del escritor espaol Jaime Arrac Montoliu.Arrac decidi explorar varios temas que despertaron su inters desde la escritura de Los aos queman, su primer libro: la posicin social, la vida de familia, la escritura, el viaje, la mente con sus quiebres y pliegues son algunos de los ejes de esta historia.",As es estar en la piel y en la mente de un esquizofrnico,https://www.eltiempo.com//cultura/musica-y-libros/resena-de-una-persona-perfecta-novela-de-jaime-arraco-431074,eltiempo,www.eltiempo.com,4,48
49ded426be59c69bf9df87bc8b96ab1a,"El gol que marc Germn Ezequiel Cano en la final de la Copa, frente al Deportivo Cali, puede ser el ms valioso de su ya larga relacin de amor con el Independiente Medelln, equipo al que lleg en 2012. Ese gol, el nmero 41 del 2019, signific un ttulo.","Germn Ezequiel Cano, por fin, tuvo su revancha",https://www.eltiempo.com//deportes/futbol-internacional/german-ezequiel-cano-gano-su-primer-titulo-con-independiente-medellin-431240,eltiempo,www.eltiempo.com,5,25
08e5b6d20d79fbf82fd51c0d9fe8e793,"El ministro de Defensa, Guillermo Botero, renunci a su cargo al caer la noche de este mircoles, justo cuando en el Senado el nmero de votos para adelantarle una mocin de censura llegaba a 67. En cuestin de horas, el funcionario se haba quedado sin oxgeno poltico para continuar en esa cartera.Cmo un funcionario que goza del aprecio del presidente Duque perdi en tan poco tiempo su margen de maniobra? Hay dos factores que jugaron de manera determinante en su contra: el pas no fue informado de que luego de un bombardeo militar a un campamento de disidentes de las Farc se encontraron menores de edad muertos por el ataque la Fiscala ha establecido al menos ocho y el hecho de que alguno de ellos fueran apenas unos nios, entre ellos una de 12 aos de edad.","Ministro Guillermo Botero, crnica de una cada anunciada",https://www.eltiempo.com//politica/gobierno/las-razones-por-las-que-cayo-el-ministro-de-defensa-guillermo-botero-431226,eltiempo,www.eltiempo.com,6,63
89425671ab2d1aa0af7eb5512671fb95,"Creemos que esta debe ser una protesta social ordenada que verdaderamente represente los intereses de todos los colombianos, y no solo de un pequeo grupo, y hemos considerado que, sobre eso, el prximo Gobierno podr hacer grandes avances si logra promover una ley estatutaria que camine en ese sentido.Esa frase que Guillermo Botero pronunci el ao pasado, antes de posesionarse como ministro de Defensa, fue una de las primeras declaraciones polmicas que lo pusieron en el ojo de la opinin pblica porque muchos sectores asumieron que la reglamentacin implicara una limitacin a este derecho.",Las polmicas y los errores que al final tumbaron a Botero,https://www.eltiempo.com//justicia/conflicto-y-narcotrafico/polemicas-del-ministro-de-defensa-guillermo-botero-431138,eltiempo,www.eltiempo.com,5,48
94e26242a9c3052c83a675e2f7c53353,"El lder opositor boliviano Luis Fernando Camacho lleg este mircoles en la noche al aeropuerto de El Alto, que presta servicio a La Paz, desde donde pretenda trasladarse a la casa de gobierno con el fin de llevarle al presidente Evo Morales una carta de renuncia para que la firme.(Lea tambin:Luis Fernando Camacho, el opositor que pone en jaque a Evo Morales)",Luis Camacho vuelve a desafiar a Evo Morales para que renuncie,https://www.eltiempo.com//mundo/latinoamerica/lider-opositor-boliviano-busca-desafiar-de-nuevo-a-evo-morales-431038,eltiempo,www.eltiempo.com,7,36
f6778c0816b10a460786336462e704e5,"Tiene apenas dos meses de nacida, pero la pequea Julia ya conoce, de primera mano, la pasin que genera el ftbol.",Futbolista amamanta a su beb en la cancha y se gana respeto de todos,https://www.eltiempo.com//cultura/gente/futbolista-espanola-amamanta-a-su-hija-durante-partidos-y-entrenamientos-431090,eltiempo,www.eltiempo.com,6,12
cb8565f4c9904d8e4d405f1b3d5fa749,"A semanas de que se realice la subasta del espectro en las bandas de 700, 1.900 y 2.500 MHz en Colombia, el Ministerio de las Tecnologas de la Informacin y la Comunicacin (MinTIC) anunci que extender el plazo de solicitudespara participar.Inicialmente, estaba previsto que la fecha final para la recepcin de solicitudes para ofertar por el espectro fuera el 5 de noviembre, pero el MinTIC anunci ayer -da que se cumpla el plazo- una ampliacin por 7 das.La razn detrs del nuevo plazo sera en virtud de procurar mayor participacin en el proceso de seleccin"".",Aprietos en la subasta del espectro por poca participacin,https://www.eltiempo.com//tecnosfera/novedades-tecnologia/tigo-y-telefonica-no-enviaron-solicitud-para-participar-en-la-subasta-430930,eltiempo,www.eltiempo.com,5,40
9ba28cbab89c10a429cb5e4405c5f760,"En una decisin que seguramente generar polmica en varios sectores polticos, la Cmara de Representantes decidi declarar la vacancia absoluta de la curul del guerrillero Jess Santrich y pedir al Consejo Nacional Electoral (CNE) el nombre del siguiente en la lista del partido Farc para posesionarlo en su reemplazo.",El partido Farc no pierde la curul de 'Jess Santrich',https://www.eltiempo.com//politica/congreso/el-partido-de-las-farc-no-pierde-la-curul-de-santrich-431214,eltiempo,www.eltiempo.com,5,29
ab4e0c0feb4ed653da9d985f376d5429,"La cantante colombiana Shakira cont detalles de una poca difcil que vivi en su relacin con el futbolista Gerard Piqu, luego de sufrir una lesin en las cuerdas vocales que la oblig a cancelar una gira en 2017.",Piqu a Shakira: No quiero un futuro con una mujer amargada,https://www.eltiempo.com//cultura/gente/pique-a-shakira-no-quiero-un-futuro-con-una-mujer-amargada-431070,eltiempo,www.eltiempo.com,6,20
e98a4bccd5fb9467f268fc6710a986eb,"La magistrada Nelly Yolanda Villamizar, encargada de hacer cumplir la sentencia del Consejo de Estado que desde el 2014 orden salvar el ro Bogot, vincul a los concejales de Bogot a un incidente de desacato que tramita por el incumplimiento de la sentencia en la orden relacionada con modificar el POT para adecuarlo a las decisiones de la providencia.Villamizar expidi un auto dentro del incidente de desacato que tramita, en la que llama a responder, a nombre del Concejo, a su presidenta Nelly Patricia Mosquera Murcia, por las razones tcnicas y jurdicas que llevaron a negar el proyecto del Plan de Ordenamiento Territorial (POT) de la administracin del alcalde Enrique Pealosa.",Magistrada del ro Bogot llama al Concejo a responder por el POT,https://www.eltiempo.com//bogota/magistrada-que-defiende-sentencia-del-rio-bogota-llama-al-concejo-a-responder-por-negar-el-pot-431002,eltiempo,www.eltiempo.com,7,56
7d7919754a24b2cb7dc7f46c5324a90b,"Pars Saint Germain, Juventus y Bayern Mnich sellaron su clasificacin para los octavos de final de la Liga de Campeones, con dos jornadas de antelacin al cierre de la fase de grupos.",Cmo les fue a los colombianos en la Champions? Ac le contamos,https://www.eltiempo.com//deportes/futbol-internacional/desempeno-de-los-jugadores-colombianos-en-la-fecha-de-champions-league-431148,eltiempo,www.eltiempo.com,5,18
1dc322829a45c1057b64e18a4b28b0b0,"Los inversionistas de Uber han esperado pacientemente un retorno de ganancias. Sin embargo, a juzgar por el ltimo informe trimestral, tendrn que esperar un poco ms.",Cmo es posible que Uber sobreviva con prdidas de US $1.200 millones,https://www.eltiempo.com//economia/sector-financiero/como-es-posible-que-uber-sobreviva-con-perdidas-de-us-1-200-millones-y-sin-haber-obtenido-beneficios-430888,eltiempo,www.eltiempo.com,7,14
d45d63d094699631b7bf8d6668588798,"Mami, yo me voy porque me toca, no hay de otra. Esas fueron las ltimas palabras que Alex Molina recuerda haber escuchado de su hijastra, una de los siete menores que el pasado 30 de agosto fallecieron en un bombardeo del Ejrcito contra un campamento de las disidencias de las Farc.","Mami, me voy porque me toca, dijo menor que muri en bombardeo",https://www.eltiempo.com//colombia/otras-ciudades/quienes-eran-los-menores-muertos-durante-bombardeo-del-ejercito-en-caqueta-431120,eltiempo,www.eltiempo.com,7,21
41d527c460a0c6e91896ede07a4fc069,"Cuando iba a estrenar Conocers al hombre de tus sueos, Woody Allen dio una entrevista, que se puede ver en YouTube, en la que revel una de las claves de su trabajo: El truco de un buen director consiste en contratar a un buen elenco.",La clave del casting / Crtica Mente,https://www.eltiempo.com//cultura/cine-y-tv/critica-de-mauricio-reina-sobre-un-dia-lluvioso-en-nueva-york-431196,eltiempo,www.eltiempo.com,4,22
efb971d66715c3c514854c12764f36f1,"Colombia ya tiene definidos a dos de sus cuatro representantes en la Copa Libertadores 2020. A Junior, campen de la Liga en el primer semestre, se unir Independiente Medelln, gracias al ttulo obtenido este mircoles en la Copa Colombia.",Este es el panorama de la clasificacin a torneos internacionales,https://www.eltiempo.com//deportes/futbol-colombiano/como-se-reparten-los-cupos-a-torneos-de-conmebol-en-colombia-431246,eltiempo,www.eltiempo.com,4,21
5225fe5a2917f11149a1354cde59b7bb,"El primer beso, el contacto fsico, la msica, perfume y, obviamente, un aspecto agradable, los cinco sentidos juegan un papel muy importante en el previo y la consumacin del acto sexual. En este episodio, junto alexperto Ezequiel Lpez Peralta (@citaconezequiel), le ensearemos a usar el odo, la vista, el olfato, el gusto y el tacto como todo un experto.","Reglas de juego para oler, tocar, saborear y disfrutar del sexo",https://www.eltiempo.com//podcast/sexo-en-tu-oido/consejos-para-usar-los-cinco-sentidos-durante-el-sexo-425768,eltiempo,www.eltiempo.com,7,32
ad37a2abf38a9c39b07bd2118cd2fee8,"Este mircoles, Guillermo Botero se convirti en el segundo miembro del gabinete con el que arranc el Gobierno Duque en dejar el barco. Ya haba salido Gloria Mara Borrero del Ministerio de Justicia para darle paso a la exmagistrada de la Corte Suprema Margarita Cabello.Botero termina cayndose despus de un juicioso debate de control poltico en su contra adelantado por el senador Roy Barreras. Al final no hubo mocin de censura, pero las denuncias del senador de la U sobre la muerte de varios menores en una operacin de bombardeo, cuyos resultados fueron revelados al pas sin ese detalle crtico, le quitaron al Mindefensa el escaso margen de maniobra poltica que un tena.","Tres claves de la cada del Mindefensa, Guillermo Botero",https://www.eltiempo.com//justicia/investigacion/analisis-por-que-renuncio-el-ministro-de-defensa-guillermo-botero-431216,eltiempo,www.eltiempo.com,6,60
0c3d349d76f83d4aea233d70e0c7811e,"El humorista lvaro Lemmon, conocido en el mundo del entretenimiento colombiano como 'El hombre caimn', le dijo adis a Sbados felices, el icnico programa en el cual particip durante ms de 40 aos.Ahora, Lemmon public un curioso mensaje en su cuenta de Twitter en el que 'busca trabajo' y destaca sus diversas cualidades para la televisin.",'El Hombre caimn' busca trabajo luego de salir de 'Sbados felices',https://www.eltiempo.com//cultura/gente/humorista-hombre-caiman-sale-de-sabados-felices-y-busca-trabajo-430816,eltiempo,www.eltiempo.com,7,28
928b81e953bc880117252b00ad04452f,"El ministro para la Comunicacin e Informacin del rgimen deVenezuela, Jorge Rodrguez, inform que estn buscando al miembro de 'los Rastrojos', Jonathan Orlando Garca, alias 'Patrn Pobre', por su participacin en el traslado del lder opositor Juan Guaid, de Venezuela a Colombia, el pasado 22 de febrero.(Lea tambin: 'Nos tomamos fotos con mucha gente': Guaid sobre imagen con Rastrojos)",Rgimen de Maduro vuelve a vincular a Guaid con banda 'los Rastrojos',https://www.eltiempo.com//mundo/venezuela/regimen-de-maduro-vuelve-a-vincular-a-guaido-con-banda-los-rastrojos-431130,eltiempo,www.eltiempo.com,7,36
8812aec4d7d4508834877838d7037fa3,"Hacia las 6 a. m. de este mircoles, Juanita Correa Valencia, de 17 aos, fue asesinada en su casa, una residencia universitaria del barrio Campo Hermoso de Manizales. La joven, oriunda del municipio de Neira (Caldas), era estudiante de primer semestre de Medicina de la Universidad de Manizales y fue asesinada por un joven que viva en la misma residencia.",Universitario que deca 'or voces internas' mat a compaera de casa,https://www.eltiempo.com//colombia/otras-ciudades/estudiante-de-universidad-de-manizales-asesino-a-companera-de-residencia-431018,eltiempo,www.eltiempo.com,7,30
18ba9ab4ea7c01f44e9ace6be576c19c,"Colombia siempre ser el hogar de esos 4,7 millones de compatriotas que, por diferentes razones, han tenido que radicarse en otras partes del mundo y extraan, desde la distancia, esta tierra que tambin los echa en falta. La nostalgia y el extraamiento suelen ser tan fuertes que no son pocos los que suean con regresar algn da y radicarse de nuevo aqu.",Comprar vivienda desde el exterior s es posible,https://www.eltiempo.com//contenido-comercial/comprar-vivienda-desde-el-exterior-si-es-posible-424476,eltiempo,www.eltiempo.com,5,31
00f844d9a71e3f873a947230ee18315d,"Luego de que el ministro de Defensa, Guillermo Botero, renunciara al cargo este mircoles, tras el debate de mocin de censura en su contra en el cual el senador Roy Barreras denunci que haban muerto menores en un bombardeo contra las disidencias de las Farc, algunos dirigentes polticos han expresado sus posiciones frente a esta decisin.",Las reacciones polticas tras la renuncia del ministro de Defensa,https://www.eltiempo.com//politica/partidos-politicos/reacciones-de-politicos-tras-la-renuncia-del-ministro-de-defensa-guillermo-botero-431152,eltiempo,www.eltiempo.com,6,28
1d4bf025f5b068426180bf21910e7069,"Luego de varias dilaciones,se inici la que parece ser la recta final del caso de Santiago Uribe Vlez, ganadero y hermano del senador lvaro Uribe Vlez por el sonado caso del grupo paramilitar conocido como los '12 apstoles' ypor el asesinato del conductor Camilo Barrientos Durn, registrado en 1994, en Yarumal (Antioquia).Desde la maana de este mircoles, 6 de noviembre, se lleva a cabo en la sala de audiencias 35, del piso 18, del Palacio de Justicia Jose Flix de Restrepo, en Medelln, la audiencia en la que se presentan los alegatos de conclusin del caso.",Se inicia recta final en juicio contra ganadero Santiago Uribe Vlez,https://www.eltiempo.com//colombia/medellin/se-reinicia-juicio-contra-santiago-uribe-velez-431118,eltiempo,www.eltiempo.com,8,52
de27c56940bd186c9b1517dc5658fc6a,Uno de los problemas que alarma al sistema educativo colombiano tiene que ver con la cada en el nmero de estudiantes matriculados en las universidades pblicas y privadas.,"Trabajar en cantidad y calidad, un reto en educacin para la capital",https://www.eltiempo.com//contenido-comercial/trabajar-en-cantidad-y-calidad-un-reto-en-educacion-para-la-capital-423704,eltiempo,www.eltiempo.com,6,13
a7d1a3440a7d46af183f5250175e531f,"Si algo reprocha nuestra sociedad y el Estado de derecho, es que los jueces acten de manera desproporcionada y conviertan el asunto de la medida de aseguramiento en un tema simblico.Con esta frase, la defensa del expresidente lvaro Uribe en cabeza del penalista Jaime Granados remata las 339 pginas de alegatos con los que busca que al exmandatario se le resuelva favorablemente su situacin jurdica, dentro del proceso que se le siguen por presunto soborno a testigos y fraude procesal.EL TIEMPO tuvo acceso al documento, y en este se seala desde la posible manipulacin de evidencia en su contra hasta pruebas de que el senador no tuvo nada que ver con el pago a testigos, por el que es investigado su abogado Diego Cadena. ",Los 6 argumentos de Uribe para librarse de la medida de aseguramiento,https://www.eltiempo.com//unidad-investigativa/la-defensa-de-alvaro-uribe-para-librarse-de-la-medida-de-aseguramiento-431202,eltiempo,www.eltiempo.com,5,54
12f1356291b606c2151f78749107b935,"Brahaman Jhusep Guevara Pabn cumpli 11 aos el domingo 20 de octubre pasado. Era un nio tierno, detallista, de un corazn grande y que, segn su mam, Luz Marina Pabn, odiaba las injusticias. No obstante su corta edad, soaba con ser doctor y comprarle una casa y un carro a su madre.","Brahaman, el nio que muri al caer de un sexto piso por un ascensor",https://www.eltiempo.com//bogota/brahaman-el-nino-que-murio-al-caer-de-un-sexto-piso-por-un-ascensor-430840,eltiempo,www.eltiempo.com,7,31
74ec4f0bf47ed95168509667050b050c,"El presidente Ivn Duque mantiene su posicin de garantizar que Colombia est a la vanguardia en paridad de gnero. Por esto, anunci un documento Conpes con el cual espera garantizar que la brecha en puestos de liderazgo en varios sectores del pas sea eliminada.",Gobierno anuncia plan para garantizar equidad de gnero en trabajo,https://www.eltiempo.com//politica/gobierno/gobierno-anuncia-plan-para-garantizar-equidad-de-genero-en-trabajo-y-politica-431220,eltiempo,www.eltiempo.com,7,23
55ba27af0f5d5416144197b23fe03059,"A Leiderman Ortiz le bombardearon la casa. El periodista sufri la detonacin de una granada en el solar de su vivienda en Caucasia, Antioquia. A los dos das otro artefacto explosivo cay en la parte delantera, destruyendo toda la fachada. Ninguno de los dos episodios, ocurridos en 2010, fue para lamentar alguna vida, pero es la hora que las amenazas y rumores de atentados en contra de su vida no cesan.",El periodista a quien muchos quieren matar y que ahora ser alcalde,https://www.eltiempo.com//colombia/medellin/leiderman-ortiz-periodista-amenazado-que-gano-elecciones-a-la-alcaldia-de-caucasi-431172,eltiempo,www.eltiempo.com,6,35
82be4f6a9792b90566f3c7c464fc45a7,"La Asamblea General de Naciones Unidas decidir este jueves si pone fin al bloqueo econmico, comercial y financiero impuesto por Estados Unidos a Cuba.",Embargo de EE. UU. a Cuba: incertidumbre por voto de Colombia,https://www.eltiempo.com//mundo/latinoamerica/embargo-a-cuba-incertidumbre-por-voto-de-colombia-431222,eltiempo,www.eltiempo.com,7,16
903cc13f7bf8a430f507084867d9298c,"Hay fenmenos celestes bastante conocidos y que no pasan desapercibidos. El ms clebre por su espectacularidad es tal vez el eclipse de Sol, en donde la Luna se interpone entre la estrella y nosotros, bloqueando su luz parcial o totalmente.","Cmo ver el trnsito de Mercurio, un evento que solo volver en 2032",https://www.eltiempo.com//vida/ciencia/como-ver-en-colombia-el-transito-de-mercurio-un-evento-que-solo-volvera-en-2032-430948,eltiempo,www.eltiempo.com,7,20
54695ad8b4496605fa8e43c5f1e03dfc,"Internet es ahora menos libre que hace diez aos, y la situacin est empeorando a medida que algunos gobiernos utilizan ms las redes sociales para manipular elecciones y controlar a los ciudadanos, en un intento por desviar la tecnologa hacia el autoritarismo, segn dice Freedom House, un grupo prodemocrtico con sede en Washington (EE. UU.).Muchos gobiernos han descubierto que la propaganda funciona mejor en las redes sociales que la censura, declar Mike Abramowitz, presidente de Freedom House, organismo que anualmente realiza el estudio Freedom on the Net. Este ao, el informe encontr que la libertad en internet en el mundo baj por noveno ao consecutivo.","Internet, en su momento de menor libertad en 10 aos",https://www.eltiempo.com//tecnosfera/novedades-tecnologia/libertad-en-internet-en-colombia-y-el-mundo-estudio-freedom-on-the-net-2019-431128,eltiempo,www.eltiempo.com,5,67
fd36c1e6efe20cc52989bd5116865258,"Recrudecimiento de la violencia poltica, persistencia del reclutamiento forzado de menores de edad, y continuidad de afectaciones a lderes sociales y poblacin civil, son algunas de las conclusiones que hace la Misin de Apoyo al Proceso de Paz de la OEA (MAPP/OEA) sobre situaciones que se vivieron en las regiones de Colombia durante el primer semestre del ao.Este informe, que coincide con el aniversario nmero 15 de la Misin en Colombia, es producto de ms de 1.600 misiones en varias zonas del pas y este mircoles fue presentado ante el Consejo Permanente de la OEA.",En al menos 19 zonas ha habido reclutamiento de menores este ao,https://www.eltiempo.com//justicia/conflicto-y-narcotrafico/reclutamiento-de-menores-y-otras-violencias-que-siguen-en-territorios-de-colombia-430986,eltiempo,www.eltiempo.com,5,44
5330a9970ce216addd972072dc61e1fd,"Estuve en Finlandia, lugar perteneciente a ese puado de naciones que parecen haber resuelto ya todos los problemas de la existencia. Encabeza los rankings de capital humano y estabilidad poltica, su PIB per cpita es de los ms altos del mundo, y su nivel de pobreza y coeficiente de Gini son de los ms bajos. Sus habitantes gozan de excelente transporte pblico; comen mucho pato, pescado y venado; el pasatiempo nacional es meterse en un sauna, y este ao, por segunda vez consecutiva, fueron designados el pueblo ms feliz de la Tierra por las Naciones Unidas.",thierry ways,https://www.eltiempo.com//opinion/columnistas/thierry-ways/cuestion-de-confianza-columna-de-thierry-ways-431142,eltiempo,www.eltiempo.com,2,52
2f77c27ed4c74946e96e17301f0f863c,"El Instituto Distrital de Turismo (IDT) anunci que abri un concurso de mritos para realizar estudios que mejoren el ingreso y la calidad del servicio en la llegada del santuario de Monserrate. Estos estudios tendrn que determinar cul es la mejor forma de organizar los parqueaderos aledaos, cules sern las medidas que garanticen un buen servicio a los visitantes del cerro y cmo integrar este atractivo turstico al centro histrico de Bogot.",Distrito abre concurso para mejorar oferta turstica en Monserrate,https://www.eltiempo.com//bogota/distrito-abre-concurso-para-mejorar-oferta-turistica-en-monserrate-431062,eltiempo,www.eltiempo.com,7,41
983eefa7a787f6c980a8cc6839945bee,"Mi familia tambin enfrent los rigores de la guerra. Mi pap junto a sus hermanos compraron unas tierras para sembrar arroz, fue un negocio prspero hasta que empezaron a extorsionarlos, y como nos negamos a pagar las amenazas se incrementaron, esto nos llev a terminar con el negocio familiar. La finca est en Sabana de Torres, en Santander, relata el coronel Juan Guerra, quien ingres a la Escuela Militar Jos Mara Crdova en 1991.",Los militares tambin han sido vctimas de despojo de tierras,https://www.eltiempo.com//justicia/conflicto-y-narcotrafico/los-militares-tambien-han-sido-victimas-de-desplazamiento-y-despojo-de-tierras-431212,eltiempo,www.eltiempo.com,6,40
412f62ada7d00ad46318439e818ab4a6,"Lo nico bueno que tiene la tragedia atroz que est viviendo el Cauca, mi departamento, si es que algo de bueno tiene esa tragedia, es que parece que por fin el resto del pas se est dando cuenta, ahora s de verdad, de que all, en ese olvidado pedazo de tierra en el sur de Colombia, est el nudo gordiano, el centro de todos nuestros problemas como sociedad. Y si el Cauca no se salva, lo dems tampoco lo har.",juan esteban constain,https://www.eltiempo.com//opinion/columnistas/juan-esteban-constain/todo-alli-columna-de-juan-esteban-constain-431150,eltiempo,www.eltiempo.com,3,39
